{
 "engine": "kokoro",
 "voice": "af_heart",
 "speed": 0.94,
 "fadeTailS": 0.3,
 "leadinS": 0.3,
 "holdS": 1.8,
 "gapS": 0.8,
 "beats": {
  "cold": {
   "chapter": "The $0.81 in the meeting",
   "cueLeadS": 0.2,
   "preDelayS": 0.4,
   "holdS": 1.2,
   "gapS": 0.6,
   "lines": [
    {
     "key": "co0",
     "text": "Your rented H100 GPU costs $3.49 an hour, and at full load it serves 1,200 output tokens per second.",
     "say": "Your rented H one hundred G P U costs three dollars and forty-nine cents an hour, and at full load it serves twelve hundred output tokens per second."
    },
    {
     "key": "co1",
     "text": "In a meeting, someone divides $3.49 by 4.32 million tokens an hour, which gives about $0.81 per million tokens.",
     "say": "In a meeting, someone divides three dollars forty-nine by four point three two million tokens an hour, which gives about eighty-one cents per million tokens."
    },
    {
     "key": "co2",
     "text": "The hosted API you use charges $1.60 per million, so self-hosting, serving the model yourself, looks twice as cheap.",
     "say": "The hosted A P I you use charges one dollar sixty per million, so self-hosting, serving the model yourself, looks twice as cheap."
    },
    {
     "key": "co3",
     "text": "A teammate adds a 4-bit checkpoint, a copy of the model that stores each weight in 4 bits instead of 16.",
     "say": "A teammate adds a four bit checkpoint, a copy of the model that stores each weight in four bits instead of sixteen."
    },
    {
     "key": "co4",
     "text": "Its page reports about 99% recovery, its benchmark score as a share of the original's, so the teammate expects a lower cost.",
     "say": "Its page reports about ninety-nine percent recovery, its benchmark score as a share of the original's, so the teammate expects a lower cost."
    },
    {
     "key": "co5",
     "text": "So is self-hosting really cheaper than the API, and what would the 4-bit checkpoint actually change?",
     "say": "So is self-hosting really cheaper than the A P I, and what would the four bit checkpoint actually change?"
    }
   ]
  },
  "title": {
   "gapS": 1,
   "holdS": 1,
   "lines": [
    {
     "key": "t0",
     "text": "Is self-hosting your LLM cheaper than the API?",
     "say": "Is self-hosting your L L M cheaper than the A P I?"
    },
    {
     "key": "t1",
     "text": "Three questions follow: what a 4-bit checkpoint makes faster, whether you can trust its 99% score, and what your real cost is.",
     "say": "Three questions follow: what a four bit checkpoint makes faster, whether you can trust its ninety-nine percent score, and what your real cost is."
    }
   ]
  },
  "c1": {
   "chapter": "What does a 4-bit checkpoint make faster?",
   "cueLeadS": 0.25,
   "preDelayS": 0.3,
   "lines": [
    {
     "key": "k0",
     "text": "A 4-bit checkpoint helps a quiet server most, and on a busy server 8 bits usually help as much or more.",
     "say": "A four bit checkpoint helps a quiet server most, and on a busy server eight bits usually help as much or more."
    },
    {
     "key": "s0",
     "text": "Your $0.81 came from 1,200 tokens per second at full load, so the checkpoint lowers it only if it raises that number.",
     "say": "Your eighty-one cents came from twelve hundred tokens per second at full load, so the checkpoint lowers it only if it raises that number."
    },
    {
     "key": "p0",
     "text": "A request has two phases, and prefill reads your whole prompt in one pass, mostly doing matrix multiplications, the bulk math."
    },
    {
     "key": "p1",
     "text": "Decode writes the answer one token at a time, and each token reads every weight from GPU memory.",
     "say": "Decode writes the answer one token at a time, and each token reads every weight from G P U memory."
    },
    {
     "key": "p2",
     "text": "With one request at a time, decode is memory-bound, which means reading the weights, not the math, sets its speed."
    },
    {
     "key": "p3",
     "text": "With many requests at once, each read of the weights serves the whole batch, so the math becomes the limit."
    },
    {
     "key": "q0",
     "text": "Here is the question. Your server runs at full load, and the checkpoint stores each weight in a quarter of the bits."
    },
    {
     "key": "q1",
     "text": "Does it cut your cost per token by four? Let's think it through."
    },
    {
     "key": "t1",
     "text": "A first thought is yes, because the GPU now moves a quarter of the bytes for every weight.",
     "say": "A first thought is yes, because the G P U now moves a quarter of the bytes for every weight."
    },
    {
     "key": "t2",
     "text": "That is reasonable when reading sets the speed, but at full load the math sets most of it."
    },
    {
     "key": "t3",
     "text": "So the real question is which part of a request's time each format makes smaller."
    },
    {
     "key": "m1",
     "text": "Step 1. The 4-bit format, called W4A16, stores the weights in 4 bits, so decode reads about a quarter of the bytes.",
     "say": "Step one. The four bit format, called W four A sixteen, stores the weights in four bits, so decode reads about a quarter of the bytes."
    },
    {
     "key": "m2",
     "text": "Step 2. It turns the weights back into 16 bits before each multiplication, so the math costs what it did before.",
     "say": "Step two. It turns the weights back into sixteen bits before each multiplication, so the math costs what it did before."
    },
    {
     "key": "m3",
     "text": "Step 3. The 8-bit format, called W8A8, stores the weights and the activations, the numbers passed between layers, in 8 bits.",
     "say": "Step three. The eight bit format, called W eight A eight, stores the weights and the activations, the numbers passed between layers, in eight bits."
    },
    {
     "key": "m4",
     "text": "Step 4. Its multiplications then run in cheaper 8-bit math, so prefill and busy batches get faster too.",
     "say": "Step four. Its multiplications then run in cheaper eight bit math, so prefill and busy batches get faster too."
    },
    {
     "key": "n0",
     "text": "One study measured both formats on Llama 3.1 70B in vLLM, an open-source serving engine.",
     "say": "One study measured both formats on Llama three point one, seventy B, in V L L M, an open-source serving engine."
    },
    {
     "key": "n0b",
     "text": "It compared them with BF16, the original 16-bit format of the weights.",
     "say": "It compared them with B F sixteen, the original sixteen bit format of the weights."
    },
    {
     "key": "n1",
     "text": "With one request at a time, a code-completion task took 50.7 seconds in BF16 on two A100 GPUs.",
     "say": "With one request at a time, a code completion task took fifty point seven seconds in B F sixteen on two A one hundred G P Us."
    },
    {
     "key": "n2",
     "text": "The 4-bit checkpoint took 35.0 seconds on one A100, while the 8-bit one took 54.3 seconds on one A100.",
     "say": "The four bit checkpoint took thirty-five seconds on one A one hundred, while the eight bit one took fifty-four point three seconds on one A one hundred."
    },
    {
     "key": "n3",
     "text": "Under load, with continuous batching, which packs many requests into each step, BF16 on four A100s served 1.4 queries per second.",
     "say": "Under load, with continuous batching, which packs many requests into each step, B F sixteen on four A one hundreds served one point four queries per second."
    },
    {
     "key": "n4",
     "text": "The 8-bit checkpoint served 2.4 and the 4-bit one 2.3, and over seven tasks the study averages 1.87x and 1.64x.",
     "say": "The eight bit checkpoint served two point four, and the four bit one two point three, and over seven tasks the study averages one point eight seven times and one point six four times."
    },
    {
     "key": "n5",
     "text": "So 4 bits win clearly only on the quiet server, and under load the gain in this study stayed below 2x.",
     "say": "So four bits win clearly only on the quiet server, and under load the gain in this study stayed below two times."
    },
    {
     "key": "r0",
     "text": "Remember: 4 bits speed a quiet server most, because decode reads fewer bytes, and 8 bits usually lift a busy one more.",
     "say": "Remember. Four bits speed a quiet server most, because decode reads fewer bytes, and eight bits usually lift a busy one more."
    },
    {
     "key": "r1",
     "text": "The trap: reading 4 bits as four times cheaper, when at full load the gain in this study was below 2x.",
     "say": "The trap. Reading four bits as four times cheaper, when at full load the gain in this study was below two times."
    },
    {
     "key": "r2",
     "text": "Try this: check whether your hours are mostly quiet or mostly at full load, and pick the format for that shape.",
     "say": "Try this. Check whether your hours are mostly quiet or mostly at full load, and pick the format for that shape."
    },
    {
     "key": "h0",
     "text": "But a faster checkpoint is worth nothing until its answers are as good as the original's."
    },
    {
     "key": "h1",
     "text": "The teammate's page answers that with one line: about 99% recovery on standard benchmarks.",
     "say": "The teammate's page answers that with one line: about ninety-nine percent recovery on standard benchmarks."
    }
   ]
  },
  "c2": {
   "chapter": "Can you trust the 99% recovery score?",
   "cueLeadS": 0.25,
   "preDelayS": 0.3,
   "lines": [
    {
     "key": "k0",
     "text": "A recovery score measures only the tasks its benchmark samples, so your gate must use your own traffic."
    },
    {
     "key": "s0",
     "text": "For 4-bit Llama 3.1 models at three sizes, the study reports 98.7 to 100.0% recovery on one standard benchmark suite.",